{
  "name": "rtpsctaxplatform",
  "version": "02.0V",
  "lockfileVersion": 2,
  "lockfileFormat": "RTPSC-package-lock",
  "generator": "aol@0.1.0",
  "platform": "rtpsctaxplatform",
  "createdAt": "2026-07-31T10:35:35.499Z",
  "engines": {
    "node": ">=22"
  },
  "packageManager": "aol@0.1.0",
  "copyright": "Copyright (c) 2026 RTPSC / Ross Tax Software. All rights reserved where not licensed.",
  "product": "AOL — Adaptive Optimized Linker",
  "disclaimer": "AOL (Adaptive Optimized Linker) is an original software product of RTPSC / Ross Tax Software. It is not affiliated with, endorsed by, sponsored by, or related to America Online, AOL LLC, Yahoo, or any similarly named consumer online service. Any resemblance in naming or nostalgic aesthetic is conceptual homage only and does not imply common source or endorsement.",
  "requires": true,
  "stats": {
    "workspaceCount": 67,
    "sectorCount": 8,
    "linkedCount": 67
  },
  "sectors": {
    "workflows": [
      "@rtp/agent-assignment-workflow",
      "@rtp/production-activation-workflow",
      "@rtp/refund-status-workflow",
      "@rtp/transcript-intake-workflow",
      "@rtp/transmission-workflow"
    ],
    "packages": [
      "@rtp/agent-build-team",
      "@rtp/agent-core",
      "@rtp/ai-assist",
      "@rtp/bank-products",
      "@rtp/canvas-core",
      "@rtp/client-config",
      "@rtp/client-identity",
      "@rtp/crm-core",
      "@rtp/data-sync",
      "@rtp/ero-governance",
      "@rtp/ero-ops",
      "@rtp/invoice-core",
      "@rtp/module-advisor",
      "@rtp/platform-core",
      "@rtp/pos-core",
      "@rtp/production-activation",
      "@rtp/production-compliance",
      "@rtp/refund-core",
      "@rtp/rtp-datastore",
      "@rtp/secure-tunnel",
      "@rtp/sri-efin",
      "@rtp/tax-data",
      "@rtp/ui-design-system",
      "@rtp/workflow-engine"
    ],
    "engines": [
      "@rtp/ai-persona-runtime",
      "@rtp/analytics-center",
      "@rtp/pdf-fill-engine",
      "@rtp/refund-intelligence-engine",
      "@rtp/refund-optimization-engine",
      "@rtp/tc-code-engine"
    ],
    "workers": [
      "@rtp/ai-persona-worker",
      "@rtp/data-sync-worker",
      "@rtp/live-source-fetcher",
      "@rtp/tds-worker",
      "@rtp/transcript-pull-worker",
      "@rtp/workflow-runner"
    ],
    "services": [
      "@rtp/ai-workforce-hub",
      "@rtp/analytics-service",
      "@rtp/api-gateway",
      "@rtp/enrollment-service",
      "@rtp/invoice-service",
      "@rtp/irs-gateway",
      "@rtp/modules-dashboard",
      "@rtp/pos-crm-service",
      "@rtp/refund-status-service",
      "@rtp/staff-portal",
      "@rtp/transcript-service",
      "@rtp/web-portal"
    ],
    "tools": [
      "@rtp/aol",
      "@rtp/ross-infinite",
      "@rtp/rossco"
    ],
    "agents": [
      "@rtp/assessment-agent",
      "@rtp/mapping-agent",
      "@rtp/markdown-agent",
      "@rtp/planning-agent",
      "@rtp/scoping-agent",
      "@rtp/seo-ownership-agent",
      "@rtp/staging-agent",
      "@rtp/testing-agent"
    ],
    "pipelines": [
      "@rtp/masterfile-pipeline",
      "@rtp/refund-status-pipeline",
      "@rtp/transmission-pipeline"
    ]
  },
  "packages": {
    "@rtp/agent-assignment-workflow": {
      "name": "@rtp/agent-assignment-workflow",
      "version": "0.1.0",
      "location": "workflows/agent-assignment-workflow",
      "sector": "workflows",
      "private": true,
      "link": true,
      "linkTarget": "workflows/agent-assignment-workflow",
      "fingerprint": "97a87b3788de368a",
      "integrity": "sha256-97a87b3788de368a170b34a1e2e974d04eda85607b5ae3f1d0d4facec85cd287",
      "scripts": [],
      "dependencies": {},
      "devDependencies": {}
    },
    "@rtp/agent-build-team": {
      "name": "@rtp/agent-build-team",
      "version": "0.1.1",
      "location": "packages/agent-build-team",
      "sector": "packages",
      "private": true,
      "link": true,
      "linkTarget": "packages/agent-build-team",
      "fingerprint": "af4e2c086d75f6d0",
      "integrity": "sha256-af4e2c086d75f6d0b535c2b81156d76a5351550c12bfc4fbdfb655a5196a4aca",
      "scripts": [
        "start",
        "team",
        "inventory",
        "report"
      ],
      "dependencies": {},
      "devDependencies": {}
    },
    "@rtp/agent-core": {
      "name": "@rtp/agent-core",
      "version": "0.1.0",
      "location": "packages/agent-core",
      "sector": "packages",
      "private": true,
      "link": true,
      "linkTarget": "packages/agent-core",
      "fingerprint": "e4f9b1381f57e1c8",
      "integrity": "sha256-e4f9b1381f57e1c8aab9661cbd540b7aea2c7b3cba3d83a9f4556dfc682018db",
      "scripts": [
        "test"
      ],
      "dependencies": {},
      "devDependencies": {}
    },
    "@rtp/ai-assist": {
      "name": "@rtp/ai-assist",
      "version": "0.1.0",
      "location": "packages/ai-assist",
      "sector": "packages",
      "private": true,
      "link": true,
      "linkTarget": "packages/ai-assist",
      "fingerprint": "cc444c69e4927073",
      "integrity": "sha256-cc444c69e492707366a79be8430b2e2585530e59c8d4b6da4a10552de8700cf4",
      "scripts": [],
      "dependencies": {},
      "devDependencies": {}
    },
    "@rtp/ai-persona-runtime": {
      "name": "@rtp/ai-persona-runtime",
      "version": "0.1.0",
      "location": "engines/ai-persona-runtime",
      "sector": "engines",
      "private": true,
      "link": true,
      "linkTarget": "engines/ai-persona-runtime",
      "fingerprint": "26dcda674e78240e",
      "integrity": "sha256-26dcda674e78240e75e2b5007a4d76fbbb8b820512b5a285930bc455b4d8e01c",
      "scripts": [],
      "dependencies": {},
      "devDependencies": {}
    },
    "@rtp/ai-persona-worker": {
      "name": "@rtp/ai-persona-worker",
      "version": "0.1.0",
      "location": "workers/ai-persona-worker",
      "sector": "workers",
      "private": true,
      "link": true,
      "linkTarget": "workers/ai-persona-worker",
      "fingerprint": "078035c6a3bdff20",
      "integrity": "sha256-078035c6a3bdff200a0d14dd4234a97ca89202a2732e49561946b42252487707",
      "scripts": [
        "start"
      ],
      "dependencies": {},
      "devDependencies": {}
    },
    "@rtp/ai-workforce-hub": {
      "name": "@rtp/ai-workforce-hub",
      "version": "0.1.0",
      "location": "services/ai-workforce-hub",
      "sector": "services",
      "private": true,
      "link": true,
      "linkTarget": "services/ai-workforce-hub",
      "fingerprint": "0785f7de2387dd96",
      "integrity": "sha256-0785f7de2387dd96debd4856e77f3a8466eef20d7cd3695c29c42edbc6d78d9d",
      "scripts": [
        "start"
      ],
      "dependencies": {},
      "devDependencies": {}
    },
    "@rtp/analytics-center": {
      "name": "@rtp/analytics-center",
      "version": "0.1.0",
      "location": "engines/analytics-center",
      "sector": "engines",
      "private": true,
      "link": true,
      "linkTarget": "engines/analytics-center",
      "fingerprint": "c512c0511aa05372",
      "integrity": "sha256-c512c0511aa053729e287f8b4aee96d359ffc7605124c42ac93b7373565b28fe",
      "scripts": [],
      "dependencies": {},
      "devDependencies": {}
    },
    "@rtp/analytics-service": {
      "name": "@rtp/analytics-service",
      "version": "0.1.0",
      "location": "services/analytics-service",
      "sector": "services",
      "private": true,
      "link": true,
      "linkTarget": "services/analytics-service",
      "fingerprint": "93c2402f5dd1b5d8",
      "integrity": "sha256-93c2402f5dd1b5d8056e047dac25bb39c30ffd85a00dcf7aa7757e3e994f2755",
      "scripts": [
        "start"
      ],
      "dependencies": {},
      "devDependencies": {}
    },
    "@rtp/aol": {
      "name": "@rtp/aol",
      "version": "0.1.0",
      "location": "tools/aol",
      "sector": "tools",
      "private": true,
      "link": true,
      "linkTarget": "tools/aol",
      "fingerprint": "2c3e56e51fc69620",
      "integrity": "sha256-2c3e56e51fc69620426f96ec38d29097d252a3be9d259e6bb7560e8d4e653ed4",
      "scripts": [],
      "dependencies": {},
      "devDependencies": {}
    },
    "@rtp/api-gateway": {
      "name": "@rtp/api-gateway",
      "version": "0.1.0",
      "location": "services/api-gateway",
      "sector": "services",
      "private": true,
      "link": true,
      "linkTarget": "services/api-gateway",
      "fingerprint": "d3a3c81a78c2618d",
      "integrity": "sha256-d3a3c81a78c2618df4040b3ff913f3cb08bab275c671772d7d56635afa02ff4a",
      "scripts": [
        "start"
      ],
      "dependencies": {},
      "devDependencies": {}
    },
    "@rtp/assessment-agent": {
      "name": "@rtp/assessment-agent",
      "version": "0.1.0",
      "location": "agents/assessment-agent",
      "sector": "agents",
      "private": true,
      "link": true,
      "linkTarget": "agents/assessment-agent",
      "fingerprint": "778e7e5ff2e0de6c",
      "integrity": "sha256-778e7e5ff2e0de6c1ef76922cd79c4870569579c59d7a7086d663ec19940acd6",
      "scripts": [],
      "dependencies": {},
      "devDependencies": {}
    },
    "@rtp/bank-products": {
      "name": "@rtp/bank-products",
      "version": "0.1.0",
      "location": "packages/bank-products",
      "sector": "packages",
      "private": true,
      "link": true,
      "linkTarget": "packages/bank-products",
      "fingerprint": "0b6fe6f3edaa731c",
      "integrity": "sha256-0b6fe6f3edaa731cefe88627376f9351229c875dfb7f811a1905de30a0f7cd66",
      "scripts": [
        "test"
      ],
      "dependencies": {},
      "devDependencies": {}
    },
    "@rtp/canvas-core": {
      "name": "@rtp/canvas-core",
      "version": "0.1.0",
      "location": "packages/canvas-core",
      "sector": "packages",
      "private": true,
      "link": true,
      "linkTarget": "packages/canvas-core",
      "fingerprint": "0645e8e5fc97a6a6",
      "integrity": "sha256-0645e8e5fc97a6a622367d14669d2cfb4a1d5f4868c191950eb7a14d1164dbca",
      "scripts": [
        "test"
      ],
      "dependencies": {},